titles,category
김은혜 원희룡 첫 역점 과제 김동연 정치 선동 말라,Politics
남편 한국 보내고질 바이든 여사가 홀로 떠난 곳 보니,Politics
의사출신 더민주 신현영 의원 인턴 근무한 병원 응급실서 읍소한 까닭은,Politics
한덕수 총리 임명에 정호영 낙마 가능성자진 사퇴 택할까,Politics
고구마고추상추들깨옥수수메밀 드디어 밭일 시작,Politics
김은혜 택시종사자 대책 발표법인택시 소득안정자금 만원 추가,Politics
첫 정상회담 진행 중특히 공들일 의제는,Politics
김은혜 남편에게 법카 가져가서 소고기 사먹지 않겠단 약속 받았다,Politics
뜨끔한 이재명 정치신인에 지지율 뒤져차이 초박빙,Politics
대통령 용산청사 레드카펫서 바이든 영접소인수회담 돌입종합,Politics
바이든 삼성 방문중 투표 잊지말라중간선거 우려 탓,Politics
이재명   윤형선 인천 계양을 역전,Politics
김건희 여사 오늘 한미 정상 만찬 전 바이든에 잠시 인사,Politics
여야 선거운동 첫 주말 총력전한덕수 임명에 정호영 거취 주목,Politics
광주서 또 찢긴 국힘 현수막이준석 훼손될 때마다 올 것,Politics
강남구의회 년생 무투표 당선예정자의 포부,Politics
용산서 한미정상회담 시작소인수회담 후 단독환담,Politics
바이든 용산 대통령실 도착첫 한미정상회담 시작,Politics
 용산 대통령실 레드카펫서 바이든 영접분 회담 돌입,Politics
충북지사 선거전에 난데없이 강원 춘천 출신 손흥민 소환 왜,Politics
이재명  윤형선  오차범위 내 역전 당해,Politics
일 노무현 전 대통령 추도식에 한덕수 총리 등 여권 총출동,Politics
연이틀 광주 간 이준석 새벽 시 현수막 복구,Politics
속보영상 윤 대통령 용산 대통령실 정문서 바이든 영접,Politics
전투기 소리보다 큰데도 오케이 선거운동 소음 유권자 불만,Politics
취재파일 사드 환경영향평가  상시접근 동시 추진조기 정상화한다,Politics
현장영상 바이든 투표 잊지마삼성 반도체 공장서 뜬금없이 발언한 이유는,Politics
바이든 용산 대통령실 도착윤 대통령과 정상회담 돌입,Politics
권성동 민주당 향해 민영화 거짓 선동선거좀 이겨보겠다고 음모론,Politics
바이든 현충원 참배 방한 둘째날 일정 시작 한미 정상회담,Politics
이준석 대선에서 큰 공 세운 강원도 밀어줄 것,Politics
이재명 이춘희 지원 유세 온다민주 세종사수 총력전,Politics
속보 바이든 서울 용산 대통령실 도착 대통령 정문 밖에서 영접,Politics
용산 청사 도착한 바이든대통령과 정상회담 시작상보,Politics
김정섭 공주시장 후보 여기서 멈추면 큰일 분골쇄신 할 것,Politics
이준석 대표가 다시 달아줬지만 또 떨어진 현수막 충격,Politics
계양을 이재명   윤형선 국힘 계양의 덫에 걸린 것,Politics
이준석 계양을 윤형선 우세 여론조사에 승세 굳히겠다 반색,Politics
 백악관 용산 대통령실 국민의집으로 지칭 화제,Politics
계양을 이재명  윤형선  오차범위 내 처음 역전 당해,Politics
김건희 여사 한미 정상 만찬 전 바이든과 잠깐 인사만,Politics
권성동 민주 민영화오염수 거짓 선동선거 좀 이겨보겠다고 음모론,Politics
이준석 대표 강원 발전 위해 예산 폭탄 떨어뜨릴 준비 됐다,Politics
만찬장 와인 게임체인저포괄적 동맹 의미식사는 팔도 산채비빔밥,Politics
박홍근 원내대표 강원도 국민의힘 의원들 윤핵관 실체 있냐 강원예산 삭감 비판,Politics
바이든 더 비스트 타고 용산 청사 도착곧 대통령과 정상회담,Politics
인천 계양을 안전지대 아니었나이재명   윤형선 ,Politics
영상 바이든 용산 대통령실 도착윤 대통령 정문서 직접 영접,Politics
현장 김은혜 산본 찾아 민주당이 기 신도시 재건축 반대여러분이 속으셨다,Politics
한미정상 확대회담 늦게 시작 예정된 분 훌쩍 넘길듯,Politics
속보  용산 청사 정문서 바이든 영접정상회담 돌입,Politics
박지현 가장 공정하다 자처하는 한동훈 김은혜 의혹 철저 수사 지시하라,Politics
오세훈 당대표 때 해법도 못 내  송영길 선인데 성과가 없다,Politics
한미정상회담 단독회담은 없어단독환담 때 긴밀조율 예상,Politics
성공한 대통령 돼 찾아뵙겠다 년 만에 친구 노무현 찾는 문재인,Politics
 용산청사 정문서 바이든 직접 영접정상회담 시작,Politics
김건희 본격 내조 들어간다바이든 만나고 열린음악회 관람,Politics
한덕수김대기이준석일  주기 추도식 당정청 총출동,Politics
김기현 검수완박 대치 징계 에 희생양 세워 앙갚음하나 맹폭,Politics
바이든 현충원 찾아 추모 만나러 용산대통령실 향한다,Politics
여권 인사들 일 노 전 대통령 추도식 대거 참석키로,Politics
이준석 강원 집중 유세국힘이든 정부든 강원도가 다 해먹는다,Politics
윤석열바이든 잠시 뒤 용산 대통령실에서 분 정상회담,Politics
골리앗 이재명  다윗 윤형선 처음으로 역전당했다,Politics
박홍근 추경서 강원 예산 대거 삭감윤핵관 실체 있나,Politics
단독 이재용 나란히 쓴 한미 국기 마스크 삼성 아이디어였다,Politics
 년 만에 봉하마을엔 밭일 시작,Politics
오늘 한미정상회담북핵문제경제안보 머리 맞댄다,Politics
 김기현 징계에 앙갚음하나 맹폭권한쟁의도 압박,Politics
급기야 박지현 나가라 외친 개딸들내부총질 논쟁 격화 정치쫌,Politics
바이든 대한민국과 함께 우리는 세계 경제 필수품 반도체 생산,Politics
방한 중에도 분유 재고량 얼마 챙기는 바이든 왜 한미 정상회담,Politics
이재명에게 치킨뼈 그릇 던져 체포된 대 술먹는데 시끄러워서,Politics
김건희 여사 정상 만찬은 안가고 바이든 대통령과 인사만,Politics
바이든 속내 갑툭튀 삼성공장서 대뜸 피터 투표 잊지마,Politics
문재인 년 만에 봉하노무현 주기 추도식 참석,Politics
노무현 주기에 윤석열 대신 의 마지막 총리 한덕수가 간다,Politics
일  주기 당정 총출동한총리참모들도 대거 봉하로종합,Politics
삼성 공장 둘러보다 뜬금없이  노동자 최고바이든 다 계획이 있었다,Politics
이준석 원주 부론산단에 삼성전자 반도체 공장 유치,Politics
선거운동 첫 주말 강원도 전성시대   심판 아닌 일꾼 선택,Politics
김건희 여사 만찬 참석 안한다바이든과 잠깐 인사만 할 듯,Politics
오늘 한미 정상회담북한 문제경제 안보 등 논의,Politics
유동규에 총 맞은 대장동 사업 실무자 직접 증인 출석법조  대장동 재판 따라잡기,Politics
이재명 일 성남 분당서 경기지사 승리 지원 유세,Politics
신대원의 플릭스 북한 핵실험 어떻게 탐지할까,Politics
권성동 민주당 민영화오염수로 지성주의 거짓 선동,Politics
바이든 대통령 평택서 무슨 말김건희 여사는 잠깐 인사만,Politics
김건희 여사 한미정상 만찬 전 바이든에 인사만찬에는 불참,Politics
년 만에 친구 노무현 찾는 문재인 전 대통령 봉하마을 풍경은,Politics
 코로나 치명률  주장 한국  감안 판단해야,Politics
 과 외교 해법 찾으려 해 코로나 매우 심각종합,Politics
김건희 여사 만찬전 바이든과 인사정상만찬엔 불참,Politics
윤형선  이재명  선거 열흘 앞 대혼전,Politics
정한범  핵실험 이성 상실하지 않는 한 불가능,Politics
대통령 한덕수 국무총리에 임명장 수여열심히 일하자종합,Politics
 한미 정상회담 도발 자제하나 정찰기 오늘도 전개,Politics
진중권 최강욱 수호 민주당 의원들에조폭은 빵에라도 가지,Politics
선거 유세 중 날아온 그릇에 맞은 이재명현장 체포된 대  시끄러워서,Politics
한미정상회담 앞두고 용산 일대 긴장 고조집회 대비 경비 강화,Politics
이재명   윤형선 계양을 오차범위 내 첫 역전,Politics
한덕수 총리지명부터 임명까지일의 기록 정치쫌,Politics
김은혜 남편에게 법카로 소고기 사먹지 말라고 했다,Politics
인천 계양을 윤형선   이재명  에스티아이,Politics
이재명 대선 땐 능력 상관없이 심판 택해지선은 일꾼 선택해야,Politics
오늘 한미정상회담북핵문제경제안보 머리 맞댄다,Politics
박근혜 정치적 고향에 도전장 내민 다둥이 워킹맘험지 도전자,Politics
페이스북 계정 만든 한덕수 자필 편지 경제 재도약 기틀 닦겠다,Politics
속보 김건희 여사 바이든 만난다공식만찬에는 불참,Politics
민주 한동훈에 질문 패싱사뭇 달라진 태도 왜,Politics
조용한 내조 김건희 여사 바이든과 깜짝 대면할 듯,Politics
한덕수에 임명장 수여한 대통령 잘 부탁드린다,Politics
지명 일만에 총리 임명 성공 윤 대통령 승부수 통했다,Politics
광주서 또 찢긴 국힘 현수막이준석 새벽 시에 다시 빨간 안전모 썼다,Politics
윤대통령 한덕수 총리에 임명장잘부탁드립니다,Politics
방한 바이든  왜 안 가나 했더니,Politics
이재명 유세 중 철제그릇에 맞아가해자 술 마시는데 시끄러워서,Politics
대 표심 바뀌나 국민의힘 지지 민주당 지지,Politics
이재명 유세중 치킨뼈 그릇 날아들어술 먹는데 시끄러워서,Politics
이재용의 넥타이 깔맞춤 만날 때는 파란색 엔 빨간색,Politics
이재명 향해 철제그릇 투척 대 술 먹는데 기분 나빠서,Politics
이재명  윤형선  오차범위내 처음 역전당해 에스티아이,Politics
이재명에 치킨뼈그릇 던진 대 술먹는데 시끄러워서,Politics
 마지막 총리 한총리 일  주기 봉하마을 간다,Politics
한미정상회담전세계 반도체 동맹 과시한 한미오늘 정상회담,Politics
강미애최태호 세종교육감 후보 단일화 결렬 네탓,Politics
 한덕수 국무총리 임명조만간 정호영 거취 판가름,Politics
윤 대통령 앞에 두고 문 대통령 바이든의 말실수,Politics
오늘 첫 한미 정상회담포괄적 전략 동맹 강조,Politics
여야 강원도서 총력전한덕수 임명에 정호영 거취 주목,Politics
년 만에 봉하마을 찾는 노무현의 친구 문재인,Politics
한동훈 조카 논문 통째로 베낀 수준조카 죄 입증 전까진 무죄,Politics
진중권 야당의원 향해 조폭보다 더해 걔들한테 배워야,Politics
오늘 한미정상회담북핵문제경제안보 머리 맞댄다,Politics
영상 이재명에 철제그릇 던진 대 술 먹는데 시끄러워서,Politics
보수정권 맞은 군내 민심은 최악 양낙규의  ,Politics
용산 첫 손님 바이든 맞이 분주레드카펫 깔리고 보안 강화,Politics
한미정상 첫 만남은 반도체 공장에서기술 동맹 첫 단추기자수첩,Politics
안철수 이재명 나 이길 자신 없어 달아나 보궐선거 동행 르포,Politics
김병관 안철수 이재명과의 싸움 얘기만분당 주민들 무시 보궐선거 동행 르포,Politics
기대에 못 미친 이재명 효과 지방선거 패배 시  복귀 가능성,Politics
엄중한 수사재판 통해  정권 사법처리 해야,Politics
단독김건희 여사 발가락 골절 시골 유기견 남몰래 구했다,Politics
김동연은 윗사람 눈치만 보는 탁상행정가,Politics
진중권 조폭한테 좀 배워라최강욱 수호 민주당 비판,Politics
오늘 한덕수 임명장 수여깊어지는 정호영 고심,Politics
반도체 혈맹 강조한 정상회담서 만찬까지 스킨십 늘린다,Politics
의정부시 시장과 갈등 빚은 부시장 직위해제해 논란,Politics
이재명 거리유세 중 봉변에 그릇 던진 대 남성 시끄러워서,Politics
 북한 코로나 상황 매우 심각도울 준비돼,Politics
단독 김은혜 캠프 간  막말 인사 또발포명령헬기사격 다 상상,Politics
이순신 장군을 건드린  반크 명백한 오류,Politics
 바이든과 면담 대신 통화하나측 확인해 줄 내용없어,Politics
정유라 페북 활동 조국 그만하면 나도 안할 것,Politics
김해시장 후보 토론특혜인구 놓고 홍태용 허성곤 공방,Politics
김은혜 취업청탁 의혹 국힘민주 맞고발이재명 후보 철제그릇에 부상,Politics
우세했던 한덕수 부결론 왜 뒤집혔나발목잡기 역풍 우려,Politics
한국을 가장 먼저 찾은 바이든이번 방한 이례적 특징은,Politics
시간차 허니문  순항 지선 앞 민주당엔 먹구름국회기자 시,Politics
한국인 폭행으로 바이든 경호원 명 미국 송환,Politics
이준석 대표 현수막 훼손범 대면연이틀 광주 찾아,Politics
정유라 페북 왜 하냐고 조국 전 장관이 그만하면 나도 접을 것,Politics
이재명에 철제그릇 던진 대 술 먹는데 시끄러워서,Politics
 이순신 해군훈련 받지 않았다반크 명백한 오류,Politics
전교조에만 연 억 지원타임오프제 교총 역차별 논란 입법레이더,Politics
격전지를 가다 음성군수 수성 나선 현직  탈환 노리는 참모,Politics
한동훈 조카 표절 피해 미 교수 그냥 통째로 다 베낀 수준이었다,Politics
김경율  정권 합수부 폐지는 권력형 금융 비리 덮은 것,Politics
한미 정상 삼성전자 첫 대면반도체 동맹 선언,Politics
오세훈측  재개발 언급 자격 있나 공급부족 장본인은 민주박원순,Politics
현수막 훼손 남성 욱해서 이준석 납득 안돼,Politics
김정은의 호통 정치시계제로 코로나가 네 탓,Politics
때 아닌 코로나 변수양승조에게 무슨 일이정상훈의 지방방송,Politics
조용한 내조 김건희 여사 바이든 만나고 열린음악회에도 참석 검토,Politics
백두대간 수목원의 백두산 호랑이,Politics
장마당 닫고 소문만 흉흉 혼란 속 북한주민,Politics
이준석 광주서 현수막 훼손범 대면알고보니 취객,Politics
실제로는 더 많다 북한 의료의 한계,Politics
요즘 북한은 고려 약 생산 박차경증에 효과 외,Politics
별일 아니다 민심동요 차단 총력전,Politics
텅 빈 북한 도시 사랑의 불사약 공급,Politics
년만에 강남구청장 배출했던 민주 수성 성공할까,Politics
한동훈 때린 고민정  취임식 영상 만뷰 나도 만뷰 영상 있어,Politics
민주당  후쿠시마 오염수 방류 반대 안 해국힘 거짓 선동 눈물겹다,Politics
이준석 대표 악당 현수막 훼손범 대면연이틀 광주 찾아,Politics
정치단 지방선거 이쯤되면 진짜 민주주의 위기다,Politics
김병준 노무현윤석열 닮은 점 소탈함과 과감함한판승부,Politics
엎치락뒤치락 김동연  김은혜강용석 행보에도 촉각,Politics
무모한 도전인천시장 선거출마 재산 원 세 청년,Politics
분간 반도체 공장 시찰한 윤석열바이든 엄지척 이재용은 세심한 의전,Politics
민정수석실 없는 민알못 정부대통령 목에 방울은 누가 달까,Politics
석렬하다 재명하다여야 지지층 원색 비방전 격화,Politics
김건희 조용한 내조 본격 돌입바이든 만나고 열린음악회 관람 유력,Politics
김병준 와  닮았다사람 대하는 건 소탈한데 생각하는 건 과감,Politics
갑자기 날아온 철제그릇이재명 내가 맞아 다행,Politics
박지현 궁지 몰리나 지지자들 사퇴나 하세요 가증스럽네요 비난 쇄도,Politics
일 국회 출석정지 김기현 검은 넥타이 매고 온 이유,Politics
문재인바이든 일 안부 전화할 듯또 무산될라 측 신중한 태도,Politics
최강욱 의원직 상실형 선고에 충격 받은 황희두무슨 일 있어도 지켜야,Politics
정상회담 기술동맹 결의 다진다현충원 참배에서 만찬까지,Politics
이준석 일  새벽 현수막 달기 연 이틀 밤차타고 광주 내려가 현수막을,Politics
바이든 순방 중 도발미국 핵심전력 한반도 배치,Politics
반도체 공장서 만난 윤 대통령바이든 경제 안보 동맹,Politics
바이든 대통령과 회동 무산된  면담 대신 통화하나,Politics
주말 신발 쇼핑에  제창까지 잇따른 파격 행보,Politics
한덕수 인준 넘은 여야협치까지는 첩첩산중,Politics
오늘 한미정상회담한반도 평화원전 협력 논의,Politics
윤석열바이든 첫 만남경제기술동맹으로 확장,Politics
우여곡절 끝 여야 협치 물꼬 공은 다시  대통령에게,Politics
 백색바이든 검정 마스크기념 촬영대화로 삼성 반도체 공장 시찰 내내 화기애애,Politics
권성동 김은혜 이 가장 사랑하는 후보,Politics
경기지사 김은혜   김동연  한국사회여론연구소,Politics
지선 다가오자 발언수위 높이는 이재명,Politics
이재용 안내로 삼성 반도체 공장 내부 시찰경청한 바이든은 땡큐 은 엄지척,Politics
권성동 최대 격전지 경기도 이겨야 진정한 의미의 정권 교체 완성,Politics
격전지를 가다 민주당 무공천 강진군수전현직 무소속 결투,Politics
인터뷰 이재명 국회 성과로 다음 대선서 평가받겠다,Politics
삼성 가서 우리 노동자 최고바이든의 기술 깐부 활용법,Politics
노영민이시종한범덕 어떡하라고똘똘한 한 채 자살골,Politics
양낙규의  북러가 집착하는 전술핵무기는,Politics
강성 지지층에 휘둘리는 민주당 이번엔 내부총질 논란,Politics
이재명 계양 소외정체 이준석 민주당 독점했던 곳,Politics
한국인 폭행 혐의 바이든 경호원  송환 마약조사,Politics
종부세 명강남구 명미성년자 증여도,Politics
이재명 효과 실체 논란명 다했다  플러스,Politics
최강욱 수호 나선 민주 진중권 조폭보다 더하다,Politics
진중권 예언  지방선거서 민주당 석에 그칠 것 이재명 도움 안 돼,Politics
동아시아 하늘 점령한다세계 최강 유령 전투기 개발하는 일본 박수찬의 ,Politics
바이든 방명록 아닌 반도체 웨이퍼에 사인 경제동맹 과시 한미 정상회담,Politics
오세훈 누구나 집 공약 불가능  송영길 만호 공급도 발표,Politics
한국  참여 공식화  대립 격랑 어떻게 넘을까 한미 정상회담,Politics
 불모지 호남 공략 박차득표율  가능할까정치쫌,Politics
문재인바이든 회동 무산  정부 어필 탓 정치쫌,Politics
이재명의 힘 첫 출발 한마디에 인준안 찬성,Politics
손흥민은 춘천에 뭐했나노영민김영환 달아오른 외인 논쟁,Politics
바이든 방한 이틀째 대통령과 정상회담기술동맹 구체화,Politics
한덕수 인준 뒤 한미정상회담선거 호재에 웃는 ,Politics
우리 시민 폭행한  특별경호국 둘 본국으로 마약 혐의도,Politics
고민정 한동훈 취임 영상 만뷰 저도 만뷰 영상 있는데,Politics
초 악수어깨동무이재용한미 정상 첫 만남 눈길 모은 포인트,Politics
전투기 이착륙 소리 정도  지방선거운동 데시벨과의 전쟁,Politics
마이크 대통령 되겠다는 박지원직전 국정원장의 이례적 꿈 뉴스원샷,Politics
진중권 조폭보다 더하다최강욱 수호  의원 비판,Politics
윤석열바이든 대통령 경제안보 동맹으로 확장 메시지 맞췄다,Politics
윤 대통령 정호영 낙마로 민주당 협치 손짓에 화답할 듯,Politics
김동연김은혜 초박빙 접전 속 상호 고발 결행포연 자욱,Politics
민주당 발목잡기 비칠까 한발 후퇴 이재명 가결론 영향도,Politics
바이든 삼성전자 평택 반도체공장 방문,Politics
여야 넘어 대통령실까지 잊을만하면 터지는 정치권 성비위,Politics
취임 일 만의 만남과거 한미정상회담 결정적 장면은,Politics
민주당 지지율 주새  국민의힘 ,Politics
바이든 방한 전에 심판의 날 항공기 먼저 출격,Politics
 동맹위해 여기 왔다 바이든 오산 연합작전 본부 같이 간다,Politics
바이든 한국은 혁신의 동력 글로벌 공급망 회복 위해 협력,Politics
민주 찬성 당론에도 여명 이탈  협조에 경의,Politics
한덕수 총리 국회인준 정호영 자진사퇴할 듯,Politics
바이든 출국직전 과 공군작전 심장부 방문 도발에 경고,Politics
용산 집무실서 오늘 한미  집중회담 정상끼리 따로 환담도,Politics
 삼성 공장서 반도체 전략동맹 선언,Politics
진중권 조폭은 빵에라도 가지 더하다최강욱 수호  비판,Politics
배달 대작전북한의 코로나 격리 생활은,Politics
정상회담 사이 단독회담도마지막날 오산 지하벙커행,Politics
삼성서 처음 마주한 한미 정상초 뜨거운 악수,Politics
바이든 최첨단 웨이퍼 서명으로 기술동맹 인증바이든 방한,Politics
오세훈 문 정부 때 뭐하다  송영길 아빠찬스 주택 공약 아닌가,Politics
바이든 삼성에서 반도체 동맹 약속,Politics
설마가 현실로경북 무소속 무서운 바람,Politics
오세훈 급조된 공약  송영길 선 성과 없어첫 토론서 격돌,Politics
진중권 최강욱 옹호 에 조폭보다 더해 걔들은 군말 없이 빵에 가,Politics
신천지 부정적 이미지 세탁과 교세 확장 위해 정치권 접근,Politics
한덕수 고비 넘겼지만 여야 협치까지 난제 산적,Politics
이재명 인천 거리유세 중 취객이 던진 철제통에 맞아종합,Politics
한덕수 인준 파국 피했다 지지율 추락 위기 느꼈나,Politics
르포 강용석의 자신감 지지율  넘을 것  정유라,Politics
정상회담 사이 단독회담도마지막날 오산 지하벙커행,Politics
영상이재명 시민이 던진 철제그릇 피습큰 부상 없어,Politics
이재명 유세 중 철제 그릇에 머리 퍽현행범 이유 묻자,Politics
나이트포커스 최강욱 항소심 재판부도 유죄심 판결 유지,Politics
 대통령에  바이든 연설 다 끝내고 실수,Politics
나이트포커스 한덕수 인준안 국회 본회의 통과여야 협치의 첫발,Politics
프레지던트 문 아니 윤한국 찾은  바이든 또 엉뚱 말실수,Politics
한동훈에 질의해봐야 손해 하루 만에 달라진 민주 질문 패싱,Politics
나이트포커스 바이든 삼성전자 반도체 공장 시찰과 첫 대면,Politics
대통령 한국 반도체 기업 투자 인센티브를 바이든 서로 투자,Politics
민주당 최강욱 수호 성명위장탈당 민형배도 이름 올렸다,Politics
김동연  김은혜 김은혜 오차범위 밖 앞서,Politics
단독 바이든 일 면담 대신 전화통화한다,Politics
한미정상회담  외교신인 대통령 백전노장 바이든 케미는종합,Politics
 여론전으로 의석 열세 극복협치 첫발 자평,Politics
뉴스  윤석열바이든 첫 일정 삼성서 반도체 동맹 시동,Politics
민간 외교관 이재용세계가 지켜봤다,Politics
문재인 청와대 출신 의원들 정치검찰의 공작 최강욱 유죄 집단 옹호,Politics
 부적격 한덕수 찬성 선회이재명 한마디 영향 미쳤나,Politics
한미 사드 기지 정상화 추진공사자재 반입제한 해제,Politics
한미정상회담삼성공장 찾은 바이든웨이퍼 생산 장비 등 관람,Politics
반도체 심장부터 찾은 바이든 대통령기술동맹 시대 열린다,Politics
반도체 경청한 바이든 삼성 직원에 땡큐 엄지척종합,Politics
삼성전자 세계 최초 나노 반도체 웨이퍼에 적힌 윤석열 ,Politics
영상 추경호 민영화 현재로서는 없다 박지현 하지 않겠다 선언하라,Politics
 인준안 일 롤러코스터바이든 방한 날 멈췄다,Politics
바이든과 삼성 공장 간 대통령이재용엔 진작 왔어야 했는데종합보,Politics
뉴스초점 한미 정상 삼성 반도체 공장서 기술동맹 선언,Politics
바이든 첫 일정 삼성서 반도체 동맹 시동,Politics
세계 최대 삼성전자공장 둘러본 바이든 직원 설명 듣고 한 첫마디,Politics
고민정 만뷰 나와 한동훈 효과 정호영도 만 나왔으니 경질해야,Politics
 한미 합작으로 반도체 태동바이든 삼성의 혁신 놀랍다,Politics
전문 조 바이든  대통령 삼성전자 평택캠퍼스 연설문,Politics
부산 여론조사 선거 후반 지지 유보층 청년 표심이 변수,Politics
번 중 번 무소속 당선장흥군민 선택은,Politics
김건희 조용한 내조 시작 바이든 만나고 열린음악회 관람 검토,Politics
후보를 만나다 논산시장무주공산에 백중세 여야 경합 치열,Politics
한동훈 합수단 폐지 추미애 비판범죄 가담할 용기 줘,Politics
바이든 숙소 하얏트호텔 현장국가안보보좌관 등 수행단 여명,Politics
단독 민주당 최강욱 성희롱 징계 선거 뒤 결론내기로,Politics
정치톡톡 김은혜 청탁 의혹 공방  범죄자에 용기 줘  서울시장 첫 토론,Politics
윤석열 경제안보 동맹 거듭나길바이든 가치 공유 한국 긴밀한 협력,Politics
바이든 언급 삼성 조인트벤처는삼성스텔란티스 배터리,Politics
