titles,category
홍준표 발 대구 매각 논란에 타 후보들 일제 반발,Politics
  인터뷰 에 유화적인 시대 끝나핵 도발 강력 대응,Politics
한총리 한미 전대통령 없었다면 못해대통령도 평가,Politics
민주 노 전 대통령 추도식 총집결지방선거 열세 반전 가능,Politics
년만에 봉하 찾은 노무현의 친구 약속 지켰다,Politics
속보  북한 망하게 할 생각 없어대화는 김정은의 선택,Politics
바이든 대통령에 집안 어른중 아일랜드 분 계시냐 까닭은,Politics
 참여는 의 시작이다,Politics
반 페미는 국제망신공약진중권서민 맞붙은 흑서 대담,Politics
윤 대통령국민의힘  지지율 선거 앞 허니문 극대화 노린다,Politics
이재명 측 윤형선 일 전 계양구 전입계양구민에게 사과해야,Politics
대선 라운드 김동연  김은혜기신도시문제 표심 좌우,Politics
하헌기 국힘에 폭탄발언 지긋지긋한 내로남불검찰공화국 아니랄까봐,Politics
송영길   오세훈 격차 확대,Politics
단독 경찰 권도형 회삿돈부터 긴급동결테라루나 돈 흐름 추적한다뉴스룸 예고,Politics
영상 김정숙 여사  추도식서 어깨춤누리꾼들 시끌,Politics
  주기에 깨어있는 강물 돼 바다 포기 않을 것,Politics
장지화 성남시장 후보 신상진 지지 퇴직공무원 명 명단 조사 촉구,Politics
단독 대통령 비서관  내달 워싱턴행 추진한미 우주개발 손잡는다,Politics
안보자원 의 더 진전된 입장 끌어내야중국 보복은 과도한 우려,Politics
내부 총질 비판받은 박지현  추모하며 힘들고 외로워도 계속 전진,Politics
이번엔 법사위원장 두고 갈등협치 물 건너 가나,Politics
노무현의 친구 문재인 전 대통령 그리웠습니다라고 써,Politics
투표 잊지 마라 바이든의 말은 실언일까,Politics
바이든 용산 대통령실 열흘 전 단장 마쳤다 설명에 언빌리버블,Politics
 대통령실 인력  감축한다했으니 예산 감축 대통령실 현재도 예산 부족,Politics
옛 동지 노무현 만난 문재인 약속 지켰다 그리운 세월 봉하 방명록엔,Politics
대통령 과 첫 인터뷰 북한을 달랠 수 있는 시대는 끝났다,Politics
정권 뺏긴 민주착잡한 주기사즉생이 그분의 자세,Politics
 봉하마을 집결의 꿈 흔들려 공화국 난폭운전 견제종합,Politics
문재인 노무현 전 대통령 추도식 참석약속 지켰다,Politics
송영길  임대주택 만호 임대 후 분양 실현 가능,Politics
이재명 지지율 역전 여론조사 결과진보단체 여론조작 고발하겠다,Politics
노무현 주기 추도식 정계 총출동  협치  결집,Politics
  망하게 할 생각 전혀없어대화 김정은의 선택,Politics
민주당 김태흠 국힘 충남지사 후보 농지법 위반다운 계약 의혹,Politics
여권 봉하 총출동 통합행보 국익 위한 유연한 리더십종합,Politics
더 앞서가는  더 뒤처지는 ,Politics
권성동 민주당 의장법사위 독식 선전포고,Politics
 통합행보 통했나 견제보다 안정으로 기우는 민심,Politics
이재명에 오차범위 내 접전 펼치는 년 인천 의사 윤형선,Politics
 추도식 시민들 이재명에 환호 에 야유박지현에 꺼져라,Politics
년만에 봉하 찾은 문재인약속을 지켰습니다 감회가 깊습니다,Politics
 추도식서 어깨춤 춘 김정숙 여사 눈길영상,Politics
수도권에 갇혀 희미한 이재명 효과향후 가도 빨간불,Politics
 여론조사 서울시장 송영길  오세훈 경기지사 김동연  김은혜   뉴스룸 예고,Politics
 정호영 사퇴 압박 버티기에 독주 프레임 우려,Politics
한미 정상회담추도식지방선거에 어떤 영향 미칠까,Politics
누구 영결식이길래울어버린 김정은 관도 직접 운구했다,Politics
미국 국기 경례 논란에 대통령실 상대국 존중 표시 의전상 결례 아냐,Politics
통합과 화해  정신 계승봉하 총집결 여야 동상이몽,Politics
난데없는 민영화 공방에국힘 이재명송영길 허위사실 유포 고발,Politics
  유화책 펴는 시대 끝남북대화의 공은 김정은에 넘어가,Politics
정의당 홍준표 토론에 감 놔라 배 놔라오만한 생각,Politics
노무현 주기 종일 붐빈 봉하마을 년만에 온 문재인 시민들이 당신 뒤를,Politics
집무실도 안 먹히고선거  민주당 반격 카드가 없다,Politics
문재인 깨어있는 강물 돼 바다 포기 않을 것,Politics
윤 대통령 회담 끝정호영 거취 등 인선 숙제 시작,Politics
대선 은혜 갚을 기회 달라이준석 부산서 지지 호소종합,Politics
노무현정신 민주당 전유물 아니다여권 인사들 봉하 총출동,Politics
지선  추도식 여야 총출동약속 지켰다  눈물 참기도,Politics
민주당 대통령실 인력  감축한다더니추가 삭감 어려워,Politics
보부터 무조건 미사일 정보의 정치화 우려이슈시개,Politics
서울시장 송영길  오세훈 오차범위 밖 앞서,Politics
봉하마을서 주기 추모식 정신 기리겠다,Politics
제주도가 전라도화 논란 지속누가 선거전략으로 접근하나,Politics
권성동 민주당 법사위원장 넘겨야박홍근 원점서 논의해야,Politics
민주당 노무현 추도식 총출동지방선거 역전 구도 노린다,Politics
 성조기에 경례한 대통령대통령실 상대국 존중 표시,Politics
지방선거 고전하는  봉하 총집결반성 메시지 진정성 주목,Politics
신창현 매립지공사 사장 년 매립 종료 회의적,Politics
문대통령 이재명원로와 오찬평산마을 집회 소음 거론종합,Politics
 가입 한국  주도 도 당연 반발 땐 대응도 단호하게,Politics
바다 포기하지 않을 것  노무현 추도식 후 소회,Politics
거제시장 선거 진흙탕 싸움조폭 스캔들부정선거 공방에 공약 실종,Politics
 추모보단 선거 의회독주  공화국,Politics
봉하마을 찾은 박지현 힘들고 외로워도 계속 전진하겠다,Politics
김종민  친한것 말고 내세울게 없어정부야권에 쓴소리,Politics
노무현 주기 추도식에 여야 봉하 총집결동상이몽,Politics
정부 미국의  안보리 진출 지지에 기존 입장 재확인한 것,Politics
정호영 거취에  시간 더 필요 권성동 스스로 판단해야,Politics
 의무방어전 한한령 도 책임 있는 역할 해야,Politics
이준석 권양숙 여사 예방대통령 좋게 본 인상 받아,Politics
노 전 대통령 주기 추도식여야 지도부 모두 참석,Politics
전기사용량 최다 싹쓸이 한강변 개구 선거 격전지로,Politics
프레스룸이 간다 고 노무현 전 대통령 주기 추도식,Politics
뉴스큐 한미정상회담노무현 추도식지방선거 영향은,Politics
김은혜   김동연 오차범위 밖  우세 ,Politics
 향한 애틋함 드러낸 이준석 권양숙 여사도 좋게 보는듯,Politics
원숭이두창 개국서 확인치사율은 뉴스룸 예고,Politics
봉하 찾은 문 전 대통령약속 지켰다  소감,Politics
윤 대통령 한국선 이사 가면 어른이 축복축하해줘 감사,Politics
년 만에  추모식 참석  전 대통령 약속 지켰습니다,Politics
벌써 친윤 대 비윤들썩이는 권력지형분기점은 지방선거,Politics
양승조  김태흠 허태정  이장우  지방선거 여론조사,Politics
김정숙 여사  추도식서 어깨춤을영상 보니,Politics
 퇴임식 된 노무현 추도식사랑합니다 환호에  커튼콜종합,Politics
정호영 거취에윤 대통령 시간이 좀 더 필요,Politics
이재명 날 키운 성남 힘 모아달라이준석 계양 갔는데제정신 아냐,Politics
여야 지도부 봉하마을 집결노무현 정신엔 국민통합  공화국 견제,Politics
이재명 희한한 이름 붙여 지분매각하는 게 민영화지지층 결집 위해 민영화 논쟁 불지피는 민주당,Politics
번지현장 안철수 후보가 밝히는 보궐선거에 뛰어든 진짜 이유,Politics
놀랍다 바이든 반응 왜박진 정상회담 비하인드 공개,Politics
추도식 두 모습박지현이준석 곤욕  문재인이재명 환호종합,Politics
추도식 참석한 문재인 대통령님 약속 지켰습니다,Politics
년 만 봉하찾은  약속 지켰다그리운 세월이었다,Politics
경기지사 지지율김은혜   김동연  ,Politics
권양숙 여사 예방 이준석 모시는데 소홀함 없도록 할 것,Politics
육군 전방  부대 총기 사고 병사 왼쪽 발등 총상 입어,Politics
정호영 거취에 시간 좀 더 필요대통령 발언 속뜻은,Politics
조응천 박지현이 내부 총질 내로남불이 당 쇄신에 도움 되나,Politics
 이사하면 어른 모시는게 전통바이든 혹시 조상이 아일랜드인인가,Politics
예상밖 격전지 된 계양을민주 대형 공약 국힘 화력 집중,Politics
 노무현 전 대통령 서거 주기 추도식년 만에 문재인 전 대통령도 참석,Politics
 주기 범야권 봉하마을서 총집결당정도 출동,Politics
최영일의 시사본부 김준형 바이든 다시 전략적 인내로 가는 듯러중 상대하기도 바쁜데 한국 문제 해결할 마음 없어,Politics
단독 유정복 인천시장 시절 수도권매립지 년까지 사용 실무합의,Politics
국가에 가슴 손 올린 대통령실 의전상 결례 아냐,Politics
대통령 권양숙 여사에게  서거 정치 역사에서 정말 안타까운 일,Politics
화보   주기 추도식 아내 연신 눈물 훔쳐,Politics
오세훈 미신 운운 송영길 대선 결과 불복하는 한풀이,Politics
박진 미중 관계 한국에 제로섬 아냐인태전략팀팀 출범,Politics
현장의재구성 김건희 여사 보고 바이든이 건넨 말장가 잘 갔네,Politics
노무현과 약속 지킨 문재인 그리운 세월이었다,Politics
한국서 투자 챙긴 바이든 일본 가서는 재무장 지지,Politics
바이든 대통령실 열흘 전 이전했다고 하자 언빌리버블,Politics
뉴스썰기 정상회담 속 불편한 질문 젠더 이슈 주목한 미 언론,Politics
여의도번지 지방선거 여야  주기 추도식 참석,Politics
이준석 대통령 바뀌니 국격 달라져 윤건영 정부 때 일정 조율,Politics
속보영상 이재명 문재인 전 대통령과 오찬 후 정치적 의미 있는 말씀 없었다,Politics
여명 발길 뜨거웠던  추도식 등장에 기립박수도,Politics
이재명 성남서 힘 모아달라이준석 분당 버리고 제정신이냐,Politics
아이폰 쓰지 마 대통령실 한미정상회담 취재  기자들에게 요구,Politics
바이든 환상 케미용산 집무실엔 언빌리버블,Politics
당정청 통합 행보 시동 이어  추도식 총집결,Politics
김동연  김은혜 송영길  오세훈 ,Politics
이종섭 국방장관 빠른 시기 내 사드 기지 정상화종합,Politics
이종섭 국방 장관 사드 기지 정상화 더 빠른 시기 내에 할 것,Politics
김은혜  채용청탁 의혹 인적성검사 결과도 조작 정황 발견,Politics
 추도식에 만천 운집 나는 깨어있는 강물,Politics
정호영 보건복지부 장관 후보자 거취 조만간 결정 전망,Politics
이재명 지지율 역전되자 조사기관 고발한다는 진보단체,Politics
 주기 추도식 엄수 친구  있기에 아프지만은 않다,Politics
정호영 옥죄는 거취 압박 자진사퇴로 기우나,Politics
계양을 초박빙 결과이재명 민주당 지지율 급락으로 어려워썰전 라이브,Politics
바이든 삼성공장서 돌연 투표 왜선거로 본 외교,Politics
국회의장 누구김진표 대세론에 조정식우상호 단일화가 변수,Politics
보수정당 봉하 추도식 참석에 감회 새로워  통합 긍정적,Politics
정세현  추도사 민주당 더 키우자에 박수세례,Politics
대통령실  가슴에 손 논란에 의전상 결례 아냐,Politics
영상 노무현의 친구 문재인 년만에 봉하마을에박수와 환호,Politics
 지선 비상등에 이해찬 등 동원령추도식 총출동,Politics
흔들리는 이재명에 커지는 문재인 등판론,Politics
송영길 서울시장 선거 저 뿐 아니라 당도 절박견제균형 살려야,Politics
김태흠 윤석열 정부 안정 위해 국민의힘 지지해 달라,Politics
윤석열 정부 인사 코드 가지명 이력 심층분석,Politics
국민의힘 차기 권력 춘추전국시대여의도 앨리스,Politics
문재인 아내 연신 눈물노무현 추도식 참석 약속 지켰다,Politics
 주기 지지층 결집 나선 검찰 공화국 맞설 것,Politics
과 여당프리미엄 내세운  투표하면 이긴다는 ,Politics
이준석 권양숙 여사 예방해  모시는 일 소홀함없게,Politics
노무현 서거 주기 추도식 엄수추모객 만천명 북적종합보,Politics
봉하마을로 집결한 여야서진통합  지지층 결집,Politics
일 만에 취임한 한덕수 정호영은 버티기 돌입,Politics
한미 정상 대만 언급 바이든은 어떻게 대만을 이용하나 뉴스,Politics
 김정은 현철해 임종까지 지켰다 어떤 배경,Politics
노무현 전 대통령 주기 추도식 엄수나는 깨어있는 강물,Politics
윤미향 위안부 할머니 이용해 사익 추구 발언 김은혜 고소,Politics
한전도 정부지분 인데지분  매각민영화라는 ,Politics
성남시장 선거 과열 정책 경쟁 대신 네거티브 양상지방선거,Politics
변성완 고리 연장 불가 박형준 탈원전 정책 실패,Politics
뉴스큐 윤석열바이든 박 일 밀착 행보엄지 척 작별인사까지,Politics
대통령실 현재 예산 갖고 부족 인력  감축하겠다더니,Politics
노무현 주기 봉하마을 총출동한 민주당 검찰공화국 맹비판,Politics
정호영 시간 좀 더 필요하다는 윤 대통령국회 원구성 삐거덕,Politics
서거일에 쓴소리 한 김종민 친노친문 정치 이제 그만하자,Politics
용산 대통령 집무실은 제의 대강 자꾸 용산 부각하는 이유는,Politics
봉하에서 만난 여야윤 대통령 일정 문제로 참석 못 해썰전 라이브,Politics
한덕수 동의 후 법사위원장 사수 목소리 키우는 민주당,Politics
 추도식서 정세현 선진국 반열 들어서 일어서 화답,Politics
 용산 집무실 열흘 전 단장 마쳐바이든 언빌리버블,Politics
김정숙 여사  추도식서 강산에 노래에 어깨춤,Politics
이재명  고발에도 언젠 민영화한다고 말하고 했느냐,Politics
골리앗 이재명  다윗 윤형선 초박빙 지역주민들 술렁,Politics
민주 특활비 상납 남재준이병기 가석방 기준 밝혀라,Politics
현장 안철수 성남 발전시킬 것성남 총향우회 통합과 화합 보여달라,Politics
김태흠 대통령과 맞짱 뜰 용기 있다지역에 필요한건 다 가져오겠다,Politics
봉하마을 노란물결시민이 자유로운 세상 만들자,Politics
외교부  중국 겨냥하는 것 아냐중국은 날선 반응,Politics
신대원의 플릭스  신형 방탄헬멧 보다 좋다 자부 가지 이유,Politics
노무현 전 대통령 주기 추도식 엄수나는 깨어있는 강물,Politics
집중진단 바이든 안보로 마무리한미 정상회담 성과는,Politics
김정은 현철해 관 운구하고 흙 끼얹어코로나 확산에도 애도 인파,Politics
 노무현 추도식 참석 이재명  전 대통령과 점심일부러 사진도,Politics
윤형선 이재명 아직도 대통령 후보라고 착각민심 못 읽어,Politics
박진 한미동맹 강화한다고  등한시하는 것 아니다,Politics
용산 찾은 오세훈 송영길 미신 운운 대선 패배 한풀이종합,Politics
 추도식 고리로 지방선거  선거전 가열,Politics
 민영화 반대 주장 이재명송영길 허위사실 유포 고발,Politics
대통령 한국선 이사가면 어른이 축복바이든 우리도 같아,Politics
선글라스 쓴 유시민부터 이준석까지봉하마을서 여야 총집결,Politics
봉하 찾은  이재명과 오찬야유 들은 이준석박지현,Politics
국가 연주때 가슴에 손 올린 대통령대통령실 의전상 결례 아냐,Politics
지지율  찍은 김에국민의힘 의원 모두 사전투표,Politics
정세균 사즉생으로 살았던 민주주의 완성 향해 가자,Politics
야권에 여권까지 봉하마을 총집합 주기 추도식,Politics
 주기 봉하에 만천 구름떼 사랑합니다 커튼콜,Politics
 독도새우 빠진 정상회담 만찬에  손님 접대 상식적,Politics
경기지사 지지율 김동연   김은혜  ,Politics
 대통령 정호영 시간 좀 더 필요길어지는 장관 공백,Politics
부산시장 후보 토론 라운드서 가덕신공항어반루프 놓고 공방,Politics
 추도객들 박지현이준석엔 꺼져라문재인이재명엔 박수,Politics
김종민 친노친문으로 기억되는 정치 이제 그만 서거일에 쓴소리,Politics
단독 공매도 차별 철폐  법안에금융위 사실상 반대,Politics
국민의힘이 광주 찍고 봉하로 간 이유는,Politics
낙승 예상 이재명 계양을 고전 왜,Politics
계양을 혼전 속 발등의 불 이재명국힘은 화력 집중,Politics
김정은 직접 운구현철해는 누구,Politics
다시 노무현의 친구로 돌아온 문재인조용한 참배 후 방명록 글만 남겨,Politics
봉하마을 찾은 여야노무현 정신 동상이몽,Politics
 불과 열흘 전 집무실 단장 마쳐바이든 언빌리버블,Politics
선거 독점왕도망자 이재명 때리기 왜,Politics
 용두사미 실패할 것거세지는  반발,Politics
김경훈 김광신 후보는 부동산 투기 달인 사퇴해야,Politics
서재헌 시민 무시하는 선거 전략 수정하라 에 맹공,Politics
이앤피  정상회담 분석 바이든  전략적 방치 중,Politics
이낙연 측 국민의힘 지지했다 악의적 소문이정재 후원회장설도 사실무근,Politics
성공한 대통령 돼 찾겠다년 만에 봉하 찾은  포착,Politics
송영길  겨냥 미신 의존해 용산 고집 오세훈 대선 패배 불복하는 한풀이,Politics
김해 봉하마을에 만여명 인파문재인 년만에 참석,Politics
바이든 탈북민 출신 태영호 만나 행운을 빈다,Politics
이재명 계양을 접전 여론조사에 결과 존중,Politics
 추도식에 여야 총집결선글라스 쓴 유시민 지지자 향해 인사,Politics
더뉴스  지방선거 최대 격전지 곳곳 초접전,Politics
문 전 대통령 봉하행 연일 공개행보 나선 이유,Politics
국회의장 후보들도 봉하마을 집결노무현 정치 실현할 것,Politics
봉하 찾은  당신 뒤를 따르고 있습니다국민의힘도 대거 참석,Politics
배진교 홍준표 선수가 심판까지빨간 옷 뒤에 숨지 마라,Politics
더뉴스 한미정상회담 마무리조 아저씨  바이든의 말말말,Politics
후보 사퇴로 흩어진 울산 동구 민주당 표심 누가 잡나,Politics
국힘 여야협치로 노무현 대통령의 성숙한 민주주의 이룩할 것,Politics
봉하 찾은 여야 지도부 국민통합  공화국 맞설 것종합,Politics
레이더 긴장의 나사 풀린 민주당 역대급 패배 맞을 수 있다,Politics
이재명  보며 멋있다 생각이제는 혼자 길 개척해야,Politics
문 전 대통령 입장하자 기립 박수봉하마을 뒤덮은 노란 물결,Politics
정세현 노무현 전 대통령 강대국에 흔들리지 않는 외교 강조,Politics
날 키운 성남 다시 힘을 이재명에이준석 제정신 아냐,Politics
정치 노무현 전 대통령 주기 추도식여야 봉하 총집결,Politics
부동산 투기 의혹 대전 지방선거 쟁점 급부상,Politics
지방선거 대전시장 여야후보 토론회 불참놓고 설전,Politics
조응천 박지현이 내부 총질 오히려 고마워 할 일 더 많다,Politics
이준석권성동 권양숙 여사와 비공개 면담왜,Politics
 정호영 거취 시간 더 필요 국힘 후보 스스로 판단해야,Politics
민주당 국힘 김광신 투기의혹김 후보 집살 돈 없어 전세 구한 것,Politics
정세현  추도식서 대선 패배로 기운 안나민주당에 힘 모아달라,Politics
옥중 김경수  주기 맞아 심정 토로진실 가둘 수 없다,Politics
김정일 총애 현철해 장례김정은 관 메고  발사 늦추고,Politics
바이든이냐 노무현이냐지방선거  주사위는 던져졌다,Politics
조응천 박지현 사퇴론에 이 내부총질못할 말 했나,Politics
윤형선 이재명 아직도 대통령 후보로 착각계양 주민이 호구인가,Politics
박지현 여가부폐지  기회보장 말안돼 권성동 시도지사 명 공천해놓고,Politics
조국 가족에 눈물 왈칵 최강욱 정치검찰로부터 지켜달라 입장문 공유,Politics
다른 나라 국기에 경례하는 대통령 의전 실수가 의미하는 것 중담 ,Politics
야도 부천에 보수 국민의힘 도전장 지방선거,Politics
국민의힘 정부 민영화 반대 외친 이재명송영길 고발,Politics
경기지사 김은혜  김동연 판세 변하나,Politics
계양을 접전에민주당 내부서 이재명 바람 오산 아니었나,Politics
안미경중 끝내고  안은   대응 숙제보복엔 당당하게,Politics
텃밭서 이재명 고전 조응천 솔직히 민망하고 속상,Politics
의문의 애기상 영기리보이세대가 송영길에 열광하는 이유,Politics
 대통령 환영만찬서 미국국가 흐르는데 가슴에 손왜,Politics
지지율 접전 이재명 민주당 후보들 어려움 겪어그래도 투표하면 이긴다,Politics
군대 안갔는데 자서전에선 군대 다녀왔다는 후보선관위 입장은,Politics
 추도식 두 모습박지현이준석 곤욕  문재인이재명 환호,Politics
미국 성조기에 경례하는 윤석열 대통령,Politics
한국 성평등 최하위 보도에 진중권 이럴까봐 경고,Politics
확장억제전략자산핵우산풀어서 쓴 알쏭달쏭 한미 안보 용어,Politics
 년만에 봉하마을로사랑합니다 시민들에 손 흔들어 화답,Politics
 이재명 무력화 연일 공세방탄 출마한 선거 독점왕,Politics
문 대통령 봉하마을서 이재명과 도시락 오찬,Politics
계양을서 뒤집힌 이재명 민주당 급락 저도 예외 아닌 것,Politics
이앤피 성공한 대통령 돼 찾겠다던  년만에  추도식 참석 ,Politics
전북교육감 서거석 후보 폭행 의혹진실 공방 가열종합,Politics
오세훈 송영길에 강북 제일 못 산다며 분노 부추겨나쁜 포퓰리즘,Politics
이재명 가 열어준 길 따라왔는데 이젠 혼자의 용기 놓지 않겠다,Politics
더뉴스 여야 봉하 총출동지방선거 영향은,Politics
백악관 솔직히 예측하기 어렵지만도발 대응 준비 돼 있다,Politics
팩트체크 공직자 인사검증 법무부에 맡길 법적 근거 없다,Politics
현장영상  서거 주기 추도식여야 지도부 일제히 참석,Politics
바이든 효과에  지방선거 싹쓸이 기대년 전과 공수교대,Politics
 추도식 고리로 지방선거  선거전 가열,Politics
야권에 여권까지 봉하마을 총집합 주기 추도식,Politics
문재인이재명 봉하서 비공개 오찬권양숙 여사도 동석,Politics
이재명 고전 여론조사에 뿔난 시민단체 낙선시키려 왜곡,Politics
시청률 대박 김건희 참석 열린음악회  사상 최고,Politics
문 전 대통령  봉하마을 찾아깨어있는 시민들 당신의 뒤 따라,Politics
국힘 이재명송영길 허위사실공표죄 고발 공기업 민영화 가짜뉴스 유포,Politics
이준석권성동 봉하서 추도식 후 권양숙 여사와 차담회,Politics
년 만에  추도식 찾은 지지자들 고생했습니다 환호,Politics
바이든 퇴임한 과 통화그만큼 믿을 수 있는 사람이라는 뜻,Politics
김동연 투기과열지구 해제 실패 관료가 책임 전가 맹공,Politics
단독 한국 미국 주도 해군훈련에 준장 단장으로 격상안보 밀착 가속화,Politics
정호영 거취 촉각시간이 좀 더 필요,Politics
이재명 낙선시키려 조작 예상밖 여론조사에 고발장 내민 시민단체,Politics
호남에서 민주당은 무엇이든 안 되는 쪽만 이야기,Politics
다섯 달만에 관복에 관 쓴 이재명 계양을 아는 분 있으면 전화해달라,Politics
이재명 낙선시키려 해 진보단체 초접전 여론조사 고발,Politics
지방선거 여야  주기 추도식 일제히 참석,Politics
 국민의례 때 가슴에 손 얹은  대통령 바이든 인스타그램 보니,Politics
시민 무시 선거운동 허탈민주당 서재헌  비판,Politics
 바이든이 양손 움켜쥔 사진 올리며 친밀한 우정신뢰기뻐,Politics
혼자 토론회 참석한 정순균 검증 안 된 후보 강남 못 맡겨,Politics
윤 대통령  정면돌파에 중국 반발,Politics
김종민 자아비판 친노친문  친한것 말곤 내세울 것 없어,Politics
남자 내각 외신 질문에 여성이 못 올라와서라는 윤 대통령플랫,Politics
단독 성폭력 폭로 강민진의 눈물 청년 정치인 저 같은 일 겪지 말길,Politics
성남 분당 찾은 이재명인천 계양 찾은 안철수,Politics
이재명 날 키운 성남 다시 힘 모아달라이준석 제정신 아냐,Politics
김어준 이재명 치킨뼈그릇 층 아닌 옥상서 던졌다,Politics
이재명 티켓 파워 끝났나무명 윤형선에 지지율 위기,Politics
