titles,category
염치없지만 한 번만 부탁  대국민 반성문에 파열음  지방선거,Politics
쿼드 정상회의 날 중러 군용기 카디즈 침범,Politics
 편중 내각 우려에  에 과감한 기회 부여 노력,Politics
이재명 직격한 이준석 분당서 날아온 거물호소인 날려달라  지방선거,Politics
이재명 날 미워하다가 적극 지지자 된 개딸들공정한 세상 열망 투영인터뷰,Politics
수성이냐 탈환이냐여론조사 없는 선 어차피 승리는 국힘 지방선거,Politics
하동군수 파전보수표 갈려 국힘 탈당 무소속 하승철 우세,Politics
계양을 위기감에이재명 윤형선 때리고 지지층 달래고,Politics
국무 일 대중국 정책 발표한일 순방 바이든 귀국 이틀만,Politics
건희사랑 만들고 사진받는 이유입연 팬클럽 회장,Politics
 새 정치 우려먹는 이재명부인 때문에 소 집착하나,Politics
이준석 캐스팅 보트 중원행격전지 충남 지원사격,Politics
대선 후보  동네 의사예상 밖 접전에 표심도 팽팽,Politics
중러 군용기 카디즈 진입 후 이탈전투기 출격 대응,Politics
하태경 한동훈이 소통령 영원히 법무장관 하는 것도 아닌데 뭘,Politics
 한미 이라크파병 인사 노무현 큰 정치인,Politics
법 하나 만드는 데 개월 소요 대통령 성공하기 힘든 시스템,Politics
젠더 갈등 지적받은  제 시야 좁았다 여성에게 과감한 기회,Politics
권위 벗어던졌다 셀카에 빠진 정치,Politics
집권당 김은혜 앞서지만 인물론 김동연과 접전 성별 쏠림 뚜렷,Politics
 출범 다음날 중러 군용기 대 카디즈 무단 진입,Politics
대통령 이런 곳에서 잤구나 숨겨져왔던 청와대 속살 더 드러낸다,Politics
 인사한미회담 큰산 넘겼다 협치 시동거나,Politics
위기의 민주당 지방선거강성 지지층 사이 갈팡질팡,Politics
정호영까지 털어낸 국민의힘 리스크 관리 총력,Politics
서울시장 선거전 후끈송오권 공약집 펼쳐보니,Politics
인터뷰 안철수 대장동 수사 정치보복 아니다이재명 책임 못 피해,Politics
내가 이겨야 이재명도 산다 민주 운명 가를 박남춘의 혈전 밀착마크,Politics
부동산 망친 노영민 뜨내기 김영환문심윤심 맞붙은 충북  현장 이곳,Politics
이재명 계양 자존심 건드렸다 황금명함 들고 뛰는 유정복 밀착마크,Politics
이재명 열세 발표에 고발도 당했다들쑥날쑥 여론조사의 비밀,Politics
북한인 줄 부부어린이합창단 사진 비꼰 황교익,Politics
동지에서 적으로전북지사 김관영  조배숙,Politics
친노 운동권  친박 공안검사 대척점 인생들의 초대형 공약대전,Politics
바이든 떠나자마자 한미일 보란 듯 카디즈 드나든 중러 전투기들,Politics
한국일본 찾아 중국 찌른 바이든,Politics
장관 겸 민정수석 인사권 쥔 한동훈소통령 논란,Politics
안철수 철새 이재명이 철새 물러나라 이건 코미디이준석과 할말 없다,Politics
대선 후보  동네 의사예상 밖 접전에 표심도 팽팽,Politics
인터뷰 눈 뜨고 나니 유명 도망자 이재명 후보에게 고마워,Politics
국회의장단 만난 대통령 공직 여성에게 과감한 기회 부여할 것,Politics
하루 수십번 띠링 공해같은 후보 홍보 전화문자,Politics
침실주방 년만에 대통령 사적 공간 본다,Politics
김태흠 충남 바꿀 힘센 도지사,Politics
박지현 대리 사과에 윤호중 개인의 입장,Politics
바이든 순방 마지막날 러 한일 방공구역 침범,Politics
 견제  출범 다음날 러 군용기 대  침범,Politics
사퇴 부담 던 국힘 법사위장 내놔라 민주 인사 참사 사과를,Politics
 정치한지 얼마 안돼 시야 넓히겠다,Politics
법무부가 공직자 인사검증 맡는다,Politics
고액 후원금  취업 청탁지도부까지 고공전 가세,Politics
윤 대통령 미국 국가 경례에 안된다는 규정없다 해명도 논란,Politics
박지현 한 번 더 기회를이준석 원 없이 일하게,Politics
이재명 계양을 접전 여론조사에 위기 느꼈나마이크 없이 조용한 유세,Politics
중러 군용기 무더기로 독도인근 카디즈 진입 등 출격,Politics
혁신 부담 느끼나  딱 학자풍 부산시장 후보 토론회 설전,Politics
김건희 여사 팬카페 건희사랑 만든 이유가회장 전한 뒷이야기,Politics
아군에게 대포 쏴박지현 대국민 사과에  지도부권리당원 반발,Politics
원주정선인제 시장군수 선거 오차범위내 격전,Politics
원주시장구자열원강수 초박빙 혈투 예고 지지율 소수점도 동률 긴장,Politics
우크라 추가 지원 언급한 윤석열 정부  등쌀에 무기도 지원,Politics
여론조사 구자열 대 이하 원강수 세 이상 강세,Politics
위기의 민주당 면목 없지만 한 번 더 기회를 달라 읍소,Politics
국회의장단 만찬 화기애애여성 관련 시야 좁았다,Politics
이준석 국민의힘은 오만한 년 집권론 아닌 년 무한책임론,Politics
대통령실 한반도 평화 프로세스불 정책 이미 폐기,Politics
중국러시아 독도 인근  진입한일 순방한 바이든에 경고,Politics
대통령 공직 인사에서 여성에 과감한 기회 부여하겠다,Politics
박지현 대국민 호소에 발칵 뒤집힌 민주당사퇴하라,Politics
한덕수와 맞바꾼 정호영 낙마정부 인물난 지속,Politics
발등의 불 떨어진 민주당박지현 홀로 대국민 읍소,Politics
하반기 국회수장에 김진표법사위 최대 난제,Politics
강원 여론조사 태백시장 이상호 위정선군수 접전,Politics
강원도지사 후보 토론회이광재김진태 공방 치열,Politics
국민의힘 이재명김동연에 화력 집중민주당 김은혜 역공,Politics
 의장 여야 협치 존중해달라  대통령 더 크게 보겠다종합보,Politics
이재명  윤형선 안철수  김병관 종합,Politics
나이트포커스 왕수석 대신 왕장관,Politics
나이트포커스 는 못 믿어 전화조사도 초박빙,Politics
윤 대통령국회의장단  노무현젠더갈등 등 소재로 화기애애 만찬종합,Politics
윤 대통령 정신 번쩍 여성에 과감한 기회 부여하겠다,Politics
 시절 검찰인사 공정 정파적 이해보다 나라와 장래 생각,Politics
나이트포커스 민주당 금가는 소리,Politics
박지원 에 장관차관수석 호남 거의 배제 개선 약속하시면 얼마나 좋겠습니까요,Politics
 시절 검찰인사 공정큰 정치인에 맞장구화기애애 만찬,Politics
바이든 만찬 빠질 뻔한 국회의장 윤석열 대통령이 직접 불렀다,Politics
 정치시작 얼마 안돼 시야 좁았다 젠더인식 지적에 반응,Politics
 이어 쿼드 정상 만난 날러 군용기  방공구역 침범,Politics
부부합창단 사진에황교익 며칠만에 과 동급,Politics
국회의장 후보에 선 김진표 선출법사위원장 대치 격화,Politics
고액 후원금  취업 청탁지도부까지 고공전 가세,Politics
중러 군용기 무더기로 독도인근 카디즈 진입 등 출격종합보,Politics
민주당 박지현 백 번천 번 사과일부 지도부 공개 반발,Politics
격전지 장성군수 민주당  무소속 현직 맞대결,Politics
격전지 고흥군수 민주당무소속년 만의 리턴매치,Politics
격전지를 가다 군위군수,Politics
젠더 갈등 유감 지적에 대통령 정치한 지 얼마 안돼 시야가 좁았다,Politics
신동욱 앵커의 시선 인공 눈물은 빨리 마른다,Politics
강원도지사 후보 토론회이광재김진태 공방 치열,Politics
후보를 만나다 대전 서구청장선 이냐  정치 신인이냐,Politics
검수완박 최고령 꼼수 김진표 차기 국회의장 후보 선출,Politics
 대통령 제 시야 좁았다인사에서 여성에 과감한 기회 부여,Politics
단독 여군도 잠수함 탄다내년부터 선발 내후년 탑승,Politics
오세훈 개 재개발 지구 지금 속도대로장애인 이동권 반드시 보장하겠다 지방선거,Politics
송영길 주택자 종부세 목숨 걸 일 아니다유엔 본부 유치해 일자리 늘릴 것 지방선거,Politics
국민의힘 이재명김동연에 화력 집중민주당 김은혜 역공,Politics
임기 끝 국회 의장단 초대한 윤석열 공직 여성에게 과감한 기회 부여할 것,Politics
윤 대통령 젠더 갈등 지적 에 시야 좁았다 여성에 과감한 기회 부여,Politics
민주당 저희 잘못 회초리 맞겠다국힘 평가절하,Politics
예상 밖 기자 질문 어떡하나 묻자  그냥 지나간다,Politics
윤 대통령 여성에게 과감한 기회 부여 노력하겠다,Politics
 조원   조추경협상 난항종합,Politics
윤 대통령 전반기 국회의장단과 만찬 제가 국민학생 때 바이든은 이미 의원,Politics
인사 실패 침묵 속 정치적 줄타기윤 대통령 아슬아슬 협치,Politics
대통령 여성에 과감한 기회뜻밖의 질문 대처법에 빵터졌다,Politics
중러 군용기 독도 인근 카디즈 무더기 진입의도는,Politics
에 쿼드까지 중국 반발정부 대응은,Politics
이재명 가짜 계양사람 공세윤형선 년 대 일의 대결,Politics
박지현 팬덤정치 결별선언에도 이재명 개딸 고맙잖아,Politics
 인사에서 여성에 과감한 기회 부여,Politics
영동군수 여론조사 정영철   윤석진 ,Politics
옥천군수 여론조사 황규철   김승룡 ,Politics
서울시장 송영길 오세훈  우세 속 강북도 차,Politics
중러 폭격기 동해상 방공식별구역 무단 진입,Politics
백브리핑 어깨춤 놓고 설왕설래추도식에서 생긴 일,Politics
 시야 좁았다여성 공직자에 과감히 기회 부여,Politics
중  러 전투기 또 방공식별구역 침범,Politics
정상회담 만찬 빠질 뻔한 박의장윤 대통령이 직접 불렀다,Politics
제발 그만 좀  사저 앞 집회 소음에 주민들 반발시위,Politics
 나치식 경례 만평 고 교사 고발당할 듯국민의힘 정치 편향적 수업 강력 처벌할 것,Politics
고액 후원금  취업 청탁지도부까지 고공전 가세,Politics
젠더갈등 지적에 정신 번쩍여성에 과감한 기회 부여,Politics
팩트체크 선거조작설 황교안 용지에 투표관리관 개인 도장 찍혀야 유효,Politics
 격전지 원주 갑 지원사격원창묵엔 정세균  박정하엔 권성동종합,Politics
말 많고 탈 많은 선거 현수막짜리 등장에 주민 반발,Politics
젠더갈등 지적에 정신 번쩍 들었다 기회 부여할 것,Politics
대통령 제 시야 좁았다 여성에 과감한 공직 기회 부여 노력할 것,Politics
북한 미국 국경일에 또 도발우리 군은 대규모 전투기 훈련,Politics
대통령 인사에서 여성에 과감한 기회 부여할 것시야 좁았다종합,Politics
  가입 다음날러 폭격기 방공구역 무더기 진입,Politics
안철수 이재명 출마 번복하고 오라 했지만 오지 않아,Politics
국회의장단 만난 웃음꽃 만발 주제는 바이든,Politics
바이든 못 만날뻔한 박병석 이게 무슨소리 버럭한 사연,Politics
 여론조사 계양을 이재명윤형선 접전분당갑 안철수 우세,Politics
이재명 효과 흔들박지현 기회 달라 대국민 호소,Politics
이재명 계승  윤석열의 입경기도 민심은,Politics
국회의장 후보에 김진표 선출 제 몸엔 민주당의 피가 흐른다,Politics
주진우 라이브 하태경 한동훈 소통령 법무부장관 영원히 하는 것도 아니고 민주당의 지나친 우려,Politics
 대통령 정신 번쩍 들었다여성에 과감한 기회 부여,Politics
한 번 더 기회를 김은혜 사퇴 민주당의 양면 전략,Politics
정호영 결국 낙마인사 검증 도마,Politics
국조실장에 윤종원 금감원장은 이병래 유력 거론,Politics
중러 군용기 대 독도 인근 방공구역 진입무슨일,Politics
정치톡톡 고액후원금 논란 타임지 인 윤석열 히로시마 의전,Politics
안철수 이재명이 철새 후보이준석과 얘기할 일 있을까,Politics
윤 대통령 임기 만료 앞둔 국회의장단과 만찬,Politics
경기에선  쌍방울 인천에선 투기 재산맞붙었다,Politics
김한규김우남부상일 대충돌 감정싸움사퇴설까지,Politics
합참 중국러시아 군용기 대 독도 인근 카디즈 진입,Politics
중러 군용기 대 카디즈 침범   등 출격 독도 인근 진입후 이탈종합,Politics
대만 군사개입 논란 부른 미일정상회담 한국에 불똥 튈라,Politics
뉴스피플 윤형선 날 거물로 만든 이재명 고마워,Politics
박지현은 한 번 더 기회를이준석은 원 없이 일하게,Politics
정면승부 전여옥 윤호중 박지현이 말한  당사자,Politics
바이든 한일 순방 마지막날 중러 군용기 카디즈 진입종합,Politics
지선경기 경기지사 김동연  김은혜부동산 정책기본소득 맞대결,Politics
 중학생 시절 포드 방한 환영 나가 바이든 포드 때 난 상원의원,Politics
절박한 민주당 반성한다 호소정치 원로도 선거전 투입,Politics
한경호 서울집 두고 진주집 매각  조규일 진주에 집도 없어,Politics
현장 인터뷰 안철수 이재명 분당갑 왔어야당권 질문엔 지금은 지방선거 생각뿐,Politics
이재명 효과 별로네읍소  마케팅 꺼낸 민주,Politics
여랑야랑가짜 계양 사람  오세훈  송영길 매너리즘 공방  춤추는 후보들,Politics
단독용산 대통령실엔 영부인실 안 둔다다음 달 일 완공,Politics
이슈체크 검증 강조하더니강력범 후보 어떻게 공천됐나,Politics
단독 보험사기 도박 전과에도 군수 후보잘못 없다 대한민국 다 그래,Politics
지선 이준석 년 무한책임론지지해달라오세훈김태흠  협약,Politics
대통령 학년때 이분이 벌써 상원의원웃음꽃 만발 만찬,Politics
대통령 박병석 고사에도 바이든 만찬 초청못 간다고 했는데,Politics
국회의장에 선 김진표 내정법사위원장 충돌 격화,Politics
아는 기자박지현 기자회견도대체 민주당에 무슨 일이,Politics
정면승부 원숭이두창 제의 팬데믹 되기엔 전파력 낮고 경로 단순,Politics
중러 군용기 무더기로 독도인근 카디즈 진입 등 출격종합,Politics
계양을 민심 들어보니지역 일꾼을 무조건 이재명,Politics
초 허리 숙인 박지현 백 번 천 번 사과민주당 내 반발도,Politics
박지현 용퇴쇄신안에 민주당 지도부 개인 의견 파열음,Politics
국회의장단 만난  바이든 포드 때부터 상원  전 주니어,Politics
패배 위기감에 민주당 지지층 총결집 한 달 새  지지율  넘게 상승,Politics
김주하 앵커가 전하는 월 일  종합뉴스 주요뉴스,Politics
국힘 최소 곳 민주 최대 곳 년 만에 뒤바뀐 전국 판세,Politics
정호영에 인간적 미안함 윤 대통령 끝까지 기다리며 연락 안 했다,Politics
합참 중국러시아 군용기 카디즈 순차적 진입후 이탈,Politics
격전지를 가다 군위군수,Politics
한미정상회담 끝나자마자 방공식별구역 침범한 중러,Politics
한미정상회담 종료되자마자중러 군용기 대 카디즈 침범,Politics
중러 폭격기전투기 대 연이어  침범 공군 전술조치,Politics
이재명 가짜 계양사람  윤형선 도망자의 억지,Politics
러중 군용기 한국방공식별구역 진입전투기 출격,Politics
종합중러 폭격기 등 대 독도 인근 진입했다 이탈,Politics
바이든 러 때린 날양국 군용기 대 독도 인근 카디즈 침입,Politics
한미 밀착하자 중러 무력시위방공식별구역 무단 진입,Politics
중러 군용기 대 독도 인근 카디즈 진입후 이탈,Politics
강원도지사 후보 토론회이광재김진태 공방 치열,Politics
박지현 쇄신안 언급에 윤호중 개인 차원 파열음종합,Politics
민주당 박지현 백 번천 번 사과일부 지도부 공개 반발,Politics
위기감 느낀 이재명 계양을 전화해달라 번 호소 후 출근길 인사,Politics
국회의장 후보에 선 김진표 선출법사위원장 대치 격화,Politics
강원 여론조사 원주갑 보선 원창묵박정하 초박빙,Politics
강원 여론조사 태백시장 이상호 위정선군수 접전,Politics
한일 갈등 떠보더니중러 이번엔 쿼드 연타에 카디즈 무단진입,Politics
침묵 깬 김진애 오세훈 저격따라쟁이 겉멋만 부려,Politics
보 중러 군용기 무더기 카디즈 침범독도 인근 진입후 이탈,Politics
군 우크라에 군수품 조기 추가 지원살상용 무기는 제외,Politics
이준석 원 없이 일하게 도와달라 판세 굳히기  지방선거,Politics
박지현 한 번 더 기회를민주 지지율 정체에 반성문  지방선거,Politics
속보 바이든 출국 직전 합참 중러 군용기 대 독도 인근 카디즈 진입 후 이탈,Politics
한미정상회담 끝나자마자중러 군용기 대 카디즈 진입,Politics
중러 군용기 독도 인근 카디즈 무더기 진입 후 이탈,Politics
이준석 야당 발목잡기 뚫고 정부 일할 수 있게 해달라,Politics
뉴있저 정호영 사퇴박지현 사과 지방선거  판세는,Politics
나동연 대 제외 전 연령서 우위국힘 지지도 ,Politics
민주 허성곤은  국힘 홍태용은 대 이상서 강세,Politics
민주 노기태국힘 김형찬 접전도덕성 공방 막판 변수,Politics
찻잔속 태풍 된 무소속정종복 우성빈에 앞서,Politics
민주 홍순헌 국힘 김성수에 고전대선 접전 양상,Politics
군사망조사위  반란군에 피살 김오랑 중령 사건 조사종합,Politics
 바이든 대만방어 발언에 승냥이에겐 엽총 독설,Politics
이준석  발목잡기 뚫고 일하게 해달라 박지현 사과에 맞불,Politics
지지율 하락에 다급한 민주당 읍소정치 판세,Politics
오차범위 내 다시 앞서 이재명  윤형선 ,Politics
번지현장 대역전 일굴 것송영길에게 듣는 막판 승부수,Politics
계양을 뒤집혔다이재명   윤형선 ,Politics
민주당 나가달라대국민 사과 박지현에 뿔난 지지자들,Politics
이재명 윤형선 김병관 안철수 ,Politics
이준석 오만한 년 집권론 아닌 년 무한책임론,Politics
인천 계양을 이재명 윤형선 경기 분당갑 안철수 김병관 ,Politics
정호영 결국 자진 사퇴여야 협치의 밀알 될 것,Politics
바이든 닷새간 첫 한일 순방중국 협공하며 엔 경고음,Politics
차기 국회의장에 친문 선 김진표 원 구성은 첩첩산중,Politics
이재명  조사 못 믿어 전화면접도 박빙,Politics
세종청사 저 국세청장 맞죠국회 인사청문회 함흥차사,Politics
신규 사망 제로 북 코로나 미스터리조선식 봉쇄가 비결,Politics
 바이든 한일순방서 잠잠 위기증폭하고 발사는 안해,Politics
고소의혹 제기 강서구 노기태김형찬 후보 연일 난타전,Politics
정호영 리스크 털어낸  협치 시동 건다,Politics
지선 패색 짙어지자민주당 읍소 전략,Politics
갈등 수면위 귤현탄약고이재명 규제 완화  윤형선 이전,Politics
갈등 수면위 귤현탄약고이재명 규제 완화  윤형선 이전,Politics
 원전재생천연가스 합리적 믹스에너지 안보 강조,Politics
단독 년 계양사람 승용차 새벽엔 목동에 낮엔 계양에,Politics
바이든  안보리 상임이사국 진출 지지 입장은,Politics
이재명  조사 현장반응과 달라 전문가 아니다,Politics
서울시장 오세훈   송영길 권수정 ,Politics
하헌기 이준석 때리며 폭탄발언 과도한 비어천가냉소조차 안 나와,Politics
부산 기초단체장 후보 지지도 대선과 차이점은,Politics
광역단체장 판세  최대 곳 석권   곳 사수해야  지방선거,Politics
기장군우성빈 정종복 ,Politics
부산 강서구노기태 김형찬 ,Politics
이재명  윤형선 초접전안철수 로 두 배 이상 앞서  지방선거,Politics
 과 정반대길 걷는다한반도 프로세스불정책 폐기,Politics
보선핫플윤형선 년 간 계양 미래 고민한 찐 계양사람,Politics
법사위 대치에 김진표 민주당 피 논란원구성 첩첩산중종합,Politics
지도부 안방 누비며 각개격파고공전은 경기에 올인종합,Politics
양산 내려간 박영선  보니 마음 편안 밭일하며 잘 계신다,Politics
선거 년 무한 책임론  백 번천 번 사과,Politics
대통령 집무실침실 어떤 모습청와대 내부도 공개한다,Politics
이재명  윤형선 안철수  김병관 ,Politics
 장악에 민정수석 권한까지 한동훈 장관 등극하나,Politics
국힘 읍소하는 박지현 안타까워사과할 사람은 뒤에 숨어,Politics
한덕수 추경 통과 도와달라이준석 유가 물가 우려 커져,Politics
박지현 팬덤 쇄신 시작부터 암초강성파 과잉 책임감 비판,Politics
박지현 팬덤 쇄신 시작부터 암초강성파 과잉 책임감 비판,Politics
이대로 가다간 완패할라다급한 민주당 내로남불 오명 벗겠다,Politics
한동훈 검찰 인사권 이어 모든 부처 인사검증까지 맡는다,Politics
궁궐이 따로 없네 침실까지 낱낱이 공개되는 청와대 내부,Politics
서울남부지검장 바통 이어받은 양석조 심재철 두 검사장의 묘한 인연,Politics
맞불 회견박지현 처절한 반성 이준석 지탄받을 공천,Politics
공군  수십대 엘리펀트 훈련 미사일 대응훈련도 준비,Politics
정유라 조국 겨냥 저는 조국 하는대로 따라하는 것내로남불 설명 부탁,Politics
김동연 씨앗 남겨달라  김은혜 뿌리를 뽑아야,Politics
민주 김은혜 채용 청탁 의혹 진실의 끝은 어딘가,Politics
송영길 명량대첩 준비하는 이순신의 마음기회를 달라,Politics
타임 영향력 인에  선정하며 당선 위해 반페미로 분열에 불 붙여,Politics
이낙연정세균문희상권노갑까지 반전위해 원로들 등판,Politics
영상 이준석 저희 공약에 남성을 대상으로 한 공약은 없었다 생각,Politics
한동훈은 소통령 인사검증 맡기려 입법예고 이틀로 단축,Politics
이준석 박지현 호소문 사과 구성요건 못 갖춰 영상,Politics
국무조정실장에 윤종원금감원장엔 이병래 유력거론,Politics
여야 추경 담판 불발국민의힘 조 민주당 최소 조,Politics
법사위원장 양보없다 여야 강대 강 대치,Politics
철제그릇 던진 가해자 만난 이재명선처 바란다 법원에 탄원서 제출,Politics
민주당 국회의장 후보에 김진표제 몸엔 민주당의 피가 흐른다,Politics
송영길 주택자 종부세 민주당 목숨 걸 일 아냐서울시장 후보 인터뷰,Politics
 년 숙원 안보리 상임이사국 야망바이든 지지 얻었지만,Politics
경기지사 후보 토론회서 난타전김은혜 기사폭행  김동연 취업청탁,Politics
여 원 없이 일하게 해달라야 팬덤 아닌 대중정당으로,Politics
이준석 이어 권성동도 민주당 읍소마저 외주화심판 다가온다,Politics
송영길 박지현 심정 이해가민주당 아주 절박한 상황,Politics
위기의 민주 박지현 쇄신론에 술렁용기 있어자격 있나 내홍,Politics
만명 다녀간  모레부터 대통령 거실침실까지 공개종합,Politics
보선핫플이재명 큰 유능한 일꾼 필요더크게 써달라,Politics
 반란 맞서다 숨진 정선엽 병장 전사 인정,Politics
김태흠 잔디 농사 판매내역 공개하라  농지법 위반 아냐,Politics
지방선거 여론조사 계양을 이재명   윤형선  초접전,Politics
초접전 여론조사에 이재명 현장 반응은 많이 달라,Politics
정하영김병수 김포시장 후보 지하철 호선 연장 두고 격돌,Politics
오세훈 재개발재건축 지금 속도 그대로 간다서울시장 후보 인터뷰,Politics
공기업 민영화 지선 쟁점 부상 조짐방지법 추진허위 선동,Politics
연일 쏟아지는 의혹부산 강서구청장 선거 네거티브전 격화,Politics
인천 계양을 이재명  윤형선  글로벌리서치,Politics
광역단체장 후보  강남구 집 소유 재산 위 김은혜,Politics
문재인박근혜가 머물던 관저 내부도 곧 공개한다,Politics
후반기 국회의장 후보에 김진표 선출원구성 협상 난항,Politics
박지현 팬덤정치와 결별 이재명 개딸님의 애정 정말 고맙잔아,Politics
시 썰전라이브 정봉주 박지현 선거 직전 사과 옳지 않아철학도 전략도 없는 정알못,Politics
단독 한동훈 직속 인사검증 단장에 검찰 출신담당관은 측근 이동균 유력,Politics
마지막 기회 달라공정과 상식의 정치,Politics
민주 괘씸해 못찍어  이재명에 기회줘야다윗과 골리앗 뚜껑 열어야 안다,Politics
황교익 김건희 부부 어린이와 찍은 사진에 북한과 동급,Politics
윤 대통령 지명 일 만에 자진사퇴 정호영이 남긴 것,Politics
자칫하면 퍼펙트 스톰 민주당 하루 번 사과강경파는 반발,Politics
이근 병가 내고 한국서 치료그 후 우크라 돌아가고 싶다,Politics
이재명 계양 테크노밸리 제 판교로호선도 끌어올 것,Politics
강원도 개 언론사 시장군수 여론조사,Politics
